{
  "model_version": "0.1.0",
  "model_family": "inc15c6f-ocr-2026-operative-notice-clauses",
  "source_document_id": "2026-13142",
  "source_original_path": "evidence/hhs-ocr-org-2023-2026/originals/ocr_2026/sha256/973323350377319d1e737d7b476ab90d18f754bd9d2505521c66b97524a22498.pdf",
  "source_original_sha256": "973323350377319d1e737d7b476ab90d18f754bd9d2505521c66b97524a22498",
  "source_publication_date": "2026-06-30",
  "source_approved_date": "2026-05-14",
  "source_effective_date": "2026-06-28",
  "source_printed_page_range": "91 FR 39626-39627",
  "source_signed_attribution": "Robert F. Kennedy, Jr., Secretary, Department of Health and Human Services",
  "referenced_preceding_chapter_edition": "88 FR 12954 (2023-03-01)",
  "independent_operative_ocr_notice_verified": true,
  "nine_roman_notice_clauses_reconciled": 9,
  "chapter_AT00_replaced": true,
  "chapter_AT10_replaced": true,
  "chapter_AT20_targeted_amendments_not_entire_republication": true,
  "existing_delegations_continued_if_consistent_not_newly_issued": true,
  "signed_individual_delegate_register_captured": false,
  "HHS_budget_FY2026_FY2027_reorganization_qualified": false,
  "current_HHS_full_legal_first_level_denominator": null,
  "items": [
    {
      "id": "INC15C6F-OCR-2026-CLAUSE-I",
      "source_clause_roman": "I",
      "source_document_id": "2026-13142",
      "source_original_sha256": "973323350377319d1e737d7b476ab90d18f754bd9d2505521c66b97524a22498",
      "source_printed_page_range": "39626",
      "source_section_locator": "AT.00_AT.10_AT.20",
      "source_clause_title": "Chapter AT outline",
      "source_amendment_classification": "chapter_outline_reaffirmed",
      "publisher_supported_meaning_summary": "The notice identifies the Chapter AT mission, organization and functions section headings",
      "source_organization_code": null,
      "legal_effect_scope": "OCR_internal_organization_and_named_functions_only",
      "effective_date": "2026-06-28",
      "notice_signatory": "Robert F. Kennedy, Jr., HHS Secretary",
      "operative_OCR_notice_supported": true,
      "independent_full_federal_law_power_inventory_certified": false,
      "new_individual_signed_delegations_proved": false,
      "HHS_budget_proposal_organizational_transfer_enacted": false,
      "interagency_command_legal_instrument_identified": false
    },
    {
      "id": "INC15C6F-OCR-2026-CLAUSE-II",
      "source_clause_roman": "II",
      "source_document_id": "2026-13142",
      "source_original_sha256": "973323350377319d1e737d7b476ab90d18f754bd9d2505521c66b97524a22498",
      "source_printed_page_range": "39626",
      "source_section_locator": "AT.00",
      "source_clause_title": "AT.00 Mission",
      "source_amendment_classification": "replaces_entire_mission_text",
      "publisher_supported_meaning_summary": "Establishes OCR mission for civil rights, conscience and religious freedom, and health information privacy/security including HIPAA and 42 CFR part 2; no new HHS-wide command asserted",
      "source_organization_code": null,
      "legal_effect_scope": "OCR_internal_organization_and_named_functions_only",
      "effective_date": "2026-06-28",
      "notice_signatory": "Robert F. Kennedy, Jr., HHS Secretary",
      "operative_OCR_notice_supported": true,
      "independent_full_federal_law_power_inventory_certified": false,
      "new_individual_signed_delegations_proved": false,
      "HHS_budget_proposal_organizational_transfer_enacted": false,
      "interagency_command_legal_instrument_identified": false
    },
    {
      "id": "INC15C6F-OCR-2026-CLAUSE-III",
      "source_clause_roman": "III",
      "source_document_id": "2026-13142",
      "source_original_sha256": "973323350377319d1e737d7b476ab90d18f754bd9d2505521c66b97524a22498",
      "source_printed_page_range": "39626",
      "source_section_locator": "AT.10",
      "source_clause_title": "AT.10 Organization",
      "source_amendment_classification": "replaces_entire_internal_organization_section",
      "publisher_supported_meaning_summary": "Publishes exactly six code-labelled OCR internal organizational components AT, ATA, ATB, ATC, ATD and ATE, effective June 28, 2026",
      "source_organization_code": null,
      "legal_effect_scope": "OCR_internal_organization_and_named_functions_only",
      "effective_date": "2026-06-28",
      "notice_signatory": "Robert F. Kennedy, Jr., HHS Secretary",
      "operative_OCR_notice_supported": true,
      "independent_full_federal_law_power_inventory_certified": false,
      "new_individual_signed_delegations_proved": false,
      "HHS_budget_proposal_organizational_transfer_enacted": false,
      "interagency_command_legal_instrument_identified": false
    },
    {
      "id": "INC15C6F-OCR-2026-CLAUSE-IV",
      "source_clause_roman": "IV",
      "source_document_id": "2026-13142",
      "source_original_sha256": "973323350377319d1e737d7b476ab90d18f754bd9d2505521c66b97524a22498",
      "source_printed_page_range": "39626",
      "source_section_locator": "AT.20_A",
      "source_clause_title": "AT.20 Immediate Office of Director functions",
      "source_amendment_classification": "amends_director_function_text",
      "publisher_supported_meaning_summary": "Renames Immediate Office; modifies conscience/religious freedom and Part 2 terminology and identifies coordination with Assistant Secretary for Public Affairs and Director of Office of Intergovernmental and External Affairs",
      "source_organization_code": "AT",
      "legal_effect_scope": "OCR_internal_organization_and_named_functions_only",
      "effective_date": "2026-06-28",
      "notice_signatory": "Robert F. Kennedy, Jr., HHS Secretary",
      "operative_OCR_notice_supported": true,
      "independent_full_federal_law_power_inventory_certified": false,
      "new_individual_signed_delegations_proved": false,
      "HHS_budget_proposal_organizational_transfer_enacted": false,
      "interagency_command_legal_instrument_identified": false
    },
    {
      "id": "INC15C6F-OCR-2026-CLAUSE-V",
      "source_clause_roman": "V",
      "source_document_id": "2026-13142",
      "source_original_sha256": "973323350377319d1e737d7b476ab90d18f754bd9d2505521c66b97524a22498",
      "source_printed_page_range": "39626-39627",
      "source_section_locator": "AT.20_C",
      "source_clause_title": "AT.20 Civil Rights Division functions",
      "source_amendment_classification": "replaces_C_subsection_functions",
      "publisher_supported_meaning_summary": "Civil Rights Division: Deputy Director for Civil Rights reports to Director; national civil rights program, subject-matter policy, guidance, priority enforcement and interagency liaison",
      "source_organization_code": "ATB",
      "legal_effect_scope": "OCR_internal_organization_and_named_functions_only",
      "effective_date": "2026-06-28",
      "notice_signatory": "Robert F. Kennedy, Jr., HHS Secretary",
      "operative_OCR_notice_supported": true,
      "independent_full_federal_law_power_inventory_certified": false,
      "new_individual_signed_delegations_proved": false,
      "HHS_budget_proposal_organizational_transfer_enacted": false,
      "interagency_command_legal_instrument_identified": false
    },
    {
      "id": "INC15C6F-OCR-2026-CLAUSE-VI",
      "source_clause_roman": "VI",
      "source_document_id": "2026-13142",
      "source_original_sha256": "973323350377319d1e737d7b476ab90d18f754bd9d2505521c66b97524a22498",
      "source_printed_page_range": "39627",
      "source_section_locator": "AT.20_D",
      "source_clause_title": "AT.20 Health Information Privacy/Data/Cybersecurity functions",
      "source_amendment_classification": "amends_D_subsection_part2",
      "publisher_supported_meaning_summary": "Adds confidentiality of substance use disorder patient records at 42 CFR Part 2; does not replace the entire subsection",
      "source_organization_code": "ATC",
      "legal_effect_scope": "OCR_internal_organization_and_named_functions_only",
      "effective_date": "2026-06-28",
      "notice_signatory": "Robert F. Kennedy, Jr., HHS Secretary",
      "operative_OCR_notice_supported": true,
      "independent_full_federal_law_power_inventory_certified": false,
      "new_individual_signed_delegations_proved": false,
      "HHS_budget_proposal_organizational_transfer_enacted": false,
      "interagency_command_legal_instrument_identified": false
    },
    {
      "id": "INC15C6F-OCR-2026-CLAUSE-VII",
      "source_clause_roman": "VII",
      "source_document_id": "2026-13142",
      "source_original_sha256": "973323350377319d1e737d7b476ab90d18f754bd9d2505521c66b97524a22498",
      "source_printed_page_range": "39627",
      "source_section_locator": "AT.20_E",
      "source_clause_title": "AT.20 Enforcement Division functions",
      "source_amendment_classification": "replaces_E_subsection_functions",
      "publisher_supported_meaning_summary": "Deputy Director for Enforcement reports to Director; field-office execution, intake, investigations, centralized case management, coordination with subject-matter divisions",
      "source_organization_code": "ATD",
      "legal_effect_scope": "OCR_internal_organization_and_named_functions_only",
      "effective_date": "2026-06-28",
      "notice_signatory": "Robert F. Kennedy, Jr., HHS Secretary",
      "operative_OCR_notice_supported": true,
      "independent_full_federal_law_power_inventory_certified": false,
      "new_individual_signed_delegations_proved": false,
      "HHS_budget_proposal_organizational_transfer_enacted": false,
      "interagency_command_legal_instrument_identified": false
    },
    {
      "id": "INC15C6F-OCR-2026-CLAUSE-VIII",
      "source_clause_roman": "VIII",
      "source_document_id": "2026-13142",
      "source_original_sha256": "973323350377319d1e737d7b476ab90d18f754bd9d2505521c66b97524a22498",
      "source_printed_page_range": "39627",
      "source_section_locator": "AT.20_F",